,0
0,Trey Radel (Representative from Florida)
1,Mitch McConnell (Senator from Kentucky)
2,Kurt Schrader (Representative from Oregon)
3,Michael Crapo (Senator from Idaho)
4,Mark Udall (Senator from Colorado)
5,Heidi Heitkamp (Senator from North Dakota)
6,Frederica Wilson (Representative from Florida)
7,Ron Barber (Representative from Arizona)
8,Chuck Fleischmann (Representative from Tennessee)
9,Steny Hoyer (Representative from Maryland)
10,John Fleming (Representative from Louisiana)
11,Adam Kinzinger (Representative from Illinois)
12,Thomas Carper (Senator from Delaware)
13,Gregg Harper (Representative from Mississippi)
14,John Dingell (Representative from Michigan)
15,Kirsten Gillibrand (Senator from New York)
16,Cory Booker (Senator from New Jersey)
17,Elizabeth Esty (Representative from Connecticut)
18,Eric Cantor (Representative from Virginia)
19,Paul Tonko (Representative from New York)
20,Orrin Hatch (Senator from Utah)
21,Niki Tsongas (Representative from Massachusetts)
22,Kerry Bentivolio (Representative from Michigan)
23,Pete Sessions (Representative from Texas)
24,John Rockefeller IV (Senator from West Virginia)
25,Steve Womack (Representative from Arkansas)
26,Randy Hultgren (Representative from Illinois)
27,Bob Casey (Senator from Pennsylvania)
28,Steve Daines (Representative from Montana)
29,Tom Price (Representative from Georgia)
30,Sander Levin (Representative from Michigan)
31,Chris Collins (Representative from New York)
32,Martha Roby (Representative from Alabama)
33,C.A. Dutch Ruppersberger (Representative from Maryland)
34,Lindsey Graham (Senator from South Carolina)
35,Lee Terry (Representative from Nebraska)
36,Timothy Bishop (Representative from New York)
37,Debbie Wasserman Schultz (Representative from Florida)
38,Vern Buchanan (Representative from Florida)
39,John McCain (Senator from Arizona)
40,Mark Pocan (Representative from Wisconsin)
41,Tom Harkin (Senator from Iowa)
42,Chaka Fattah (Representative from Pennsylvania)
43,Edward Markey (Senator from Massachusetts)
44,Patrick Murphy (Representative from Florida)
45,Cory Gardner (Representative from Colorado)
46,Ileana Ros-Lehtinen (Representative from Florida)
47,Scott Peters (Representative from California)
48,Adam Schiff (Representative from California)
49,Doug Lamborn (Representative from Colorado)
50,Kyrsten Sinema (Representative from Arizona)
51,Kevin McCarthy (Representative from California)
52,Robert Scott (Representative from Virginia)
53,Robert Goodlatte (Representative from Virginia)
54,Billy Long (Representative from Missouri)
55,Jack Kingston (Representative from Georgia)
56,Mario Diaz-Balart (Representative from Florida)
57,Brian Higgins (Representative from New York)
58,Roy Blunt (Senator from Missouri)
59,Bernard Sanders (Senator from Vermont)
60,Yvette Clarke (Representative from New York)
61,Michael McCaul (Representative from Texas)
62,Daniel Lipinski (Representative from Illinois)
63,Nita Lowey (Representative from New York)
64,Lynn Jenkins (Representative from Kansas)
65,Tom Rooney (Representative from Florida)
66,Tom Graves (Representative from Georgia)
67,Jeanne Shaheen (Senator from New Hampshire)
68,John Shimkus (Representative from Illinois)
69,John Barrasso (Senator from Wyoming)
70,Amy Klobuchar (Senator from Minnesota)
71,Raul Ruiz (Representative from California)
72,Richard Burr (Senator from North Carolina)
73,Mike Lee (Senator from Utah)
74,Bill Cassidy (Representative from Louisiana)
75,Harold Rogers (Representative from Kentucky)
76,Tim Walz (Representative from Minnesota)
77,Patrick Leahy (Senator from Vermont)
78,Jim Langevin (Representative from Rhode Island)
79,Michele Bachmann (Representative from Minnesota)
80,Barbara Mikulski (Senator from Maryland)
81,Jim Himes (Representative from Connecticut)
82,Lois Frankel (Representative from Florida)
83,David Schweikert (Representative from Arizona)
84,Vicky Hartzler (Representative from Missouri)
85,Scott Perry (Representative from Pennsylvania)
86,John Boehner (Representative from Ohio)
87,Joe Heck (Representative from Nevada)
88,Phil Roe (Representative from Tennessee)
89,Peter Roskam (Representative from Illinois)
90,Bob Corker (Senator from Tennessee)
91,Erik Paulsen (Representative from Minnesota)
92,Bill Enyart (Representative from Illinois)
93,Pat Roberts (Senator from Kansas)
94,Robert Pittenger (Representative from North Carolina)
95,Mark Meadows (Representative from North Carolina)
96,Eleanor Norton (Representative from NA)
97,Joe Barton (Representative from Texas)
98,John Culberson (Representative from Texas)
99,Chris Van Hollen (Representative from Maryland)
100,Todd Rokita (Representative from Indiana)
101,Dana Rohrabacher (Representative from California)
102,Donna Edwards (Representative from Maryland)
103,Maria Cantwell (Senator from Washington)
104,Tammy Baldwin (Senator from Wisconsin)
105,Donald Payne Jr. (Representative from New Jersey)
106,Pat Meehan (Representative from Pennsylvania)
107,Michael Fitzpatrick (Representative from Pennsylvania)
108,Betty McCollum (Representative from Minnesota)
109,Mike Pompeo (Representative from Kansas)
110,Richard Blumenthal (Senator from Connecticut)
111,Kelly Ayotte (Senator from New Hampshire)
112,Dan Benishek (Representative from Michigan)
113,Sheila Jackson-Lee (Representative from Texas)
114,Bill Johnson (Representative from Ohio)
115,AndrÌ© Carson (Representative from Indiana)
116,Ann Wagner (Representative from Missouri)
117,John Cornyn (Senator from Texas)
118,John Hoeven (Senator from North Dakota)
119,Christopher Murphy (Senator from Connecticut)
120,Robert Wittman (Representative from Virginia)
121,Sean Maloney (Representative from New York)
122,Barbara Boxer (Senator from California)
123,Dean Heller (Senator from Nevada)
124,Jerry McNerney (Representative from California)
125,Tom Cotton (Representative from Arkansas)
126,Mike Coffman (Representative from Colorado)
127,Benjamin Cardin (Senator from Maryland)
128,Larry Bucshon (Representative from Indiana)
129,Darrell Issa (Representative from California)
130,Rob Portman (Senator from Ohio)
131,John Garamendi (Representative from California)
132,Cedric Richmond (Representative from Louisiana)
133,Alan Grayson (Representative from Florida)
134,Patrick McHenry (Representative from North Carolina)
135,Sheldon Whitehouse (Senator from Rhode Island)
136,Sherrod Brown (Senator from Ohio)
137,Edward Whitfield (Representative from Kentucky)
138,Janice Hahn (Representative from California)
139,Stephen Fincher (Representative from Tennessee)
140,Scott DesJarlais (Representative from Tennessee)
141,John Delaney (Representative from Maryland)
142,Brad Wenstrup (Representative from Ohio)
143,Jack Reed (Senator from Rhode Island)
144,Blake Farenthold (Representative from Texas)
145,Joyce Beatty (Representative from Ohio)
146,Kevin Brady (Representative from Texas)
147,Todd Young (Representative from Indiana)
148,Candice Miller (Representative from Michigan)
149,Mark Pryor (Senator from Arkansas)
150,Glenn Thompson (Representative from Pennsylvania)
151,Dina Titus (Representative from Nevada)
152,Tim Scott (Senator from South Carolina)
153,David Price (Representative from North Carolina)
154,Jim McGovern (Representative from Massachusetts)
155,Thomas Massie (Representative from Kentucky)
156,Frank Pallone (Representative from New Jersey)
157,Michael Turner (Representative from Ohio)
158,Scott Tipton (Representative from Colorado)
159,Michelle Lujan Grisham (Representative from New Mexico)
160,Joe Donnelly (Senator from Indiana)
161,Tim Huelskamp (Representative from Kansas)
162,Raul Labrador (Representative from Idaho)
163,Bill Flores (Representative from Texas)
164,Charles Grassley (Senator from Iowa)
165,Marco Rubio (Senator from Florida)
166,David McKinley (Representative from West Virginia)
167,Dave Joyce (Representative from Ohio)
168,Ken Calvert (Representative from California)
169,Jeff Merkley (Senator from Oregon)
170,Maxine Waters (Representative from California)
171,Bill Huizenga (Representative from Michigan)
172,Jerry Moran (Senator from Kansas)
173,Dan Maffei (Representative from New York)
174,Kevin Cramer (Representative from North Dakota)
175,Brad Schneider (Representative from Illinois)
176,Tim Murphy (Representative from Pennsylvania)
177,Zoe Lofgren (Representative from California)
178,Richard Hudson (Representative from North Carolina)
179,Mark Kirk (Senator from Illinois)
180,Matt Salmon (Representative from Arizona)
181,Shelley Capito (Representative from West Virginia)
182,Angus King (Senator from Maine)
183,Jeffrey Duncan (Representative from South Carolina)
184,Roger Williams (Representative from Texas)
185,Kevin Yoder (Representative from Kansas)
186,Jeffrey Denham (Representative from California)
187,Jim Renacci (Representative from Ohio)
188,Renee Ellmers (Representative from North Carolina)
189,Steve Stivers (Representative from Ohio)
190,Al Franken (Senator from Minnesota)
191,Robert Menendez (Senator from New Jersey)
192,Debbie Stabenow (Senator from Michigan)
193,Brad Sherman (Representative from California)
194,Bill Pascrell Jr. (Representative from New Jersey)
195,Greg Walden (Representative from Oregon)
196,Sam Farr (Representative from California)
197,Keith Rothfus (Representative from Pennsylvania)
198,Bill Foster (Representative from Illinois)
199,Ann Kuster (Representative from New Hampshire)
200,Ron DeSantis (Representative from Florida)
201,K. Conaway (Representative from Texas)
202,Michael Honda (Representative from California)
203,Frank LoBiondo (Representative from New Jersey)
204,Jim Bridenstine (Representative from Oklahoma)
205,Keith Ellison (Representative from Minnesota)
206,Mike Quigley (Representative from Illinois)
207,Chris Gibson (Representative from New York)
208,Tim Walberg (Representative from Michigan)
209,Eddie Johnson (Representative from Texas)
210,Rodney Davis (Representative from Illinois)
211,Jason Smith (Representative from Missouri)
212,Eric Swalwell (Representative from California)
213,Alan Lowenthal (Representative from California)
214,Ted Poe (Representative from Texas)
215,Robert Aderholt (Representative from Alabama)
216,Tim Griffin (Representative from Arkansas)
217,Ron Wyden (Senator from Oregon)
218,Steve Cohen (Representative from Tennessee)
219,Rick Crawford (Representative from Arkansas)
220,Jackie Speier (Representative from California)
221,Kathy Castor (Representative from Florida)
222,Charles Boustany Jr. (Representative from Louisiana)
223,Tony Cardenas (Representative from California)
224,Ted Cruz (Senator from Texas)
225,Ron Kind (Representative from Wisconsin)
226,David Vitter (Senator from Louisiana)
227,Paul Gosar (Representative from Arizona)
228,Pete Gallego (Representative from Texas)
229,Virginia Foxx (Representative from North Carolina)
230,Michael Enzi (Senator from Wyoming)
231,Tim Ryan (Representative from Ohio)
232,Juan Vargas (Representative from California)
233,Mary Landrieu (Senator from Louisiana)
234,Eliot Engel (Representative from New York)
235,Henry Cuellar (Representative from Texas)
236,Kristi Noem (Representative from South Dakota)
237,Emanuel Cleaver II (Representative from Missouri)
238,Joe Manchin III (Senator from West Virginia)
239,Johnny Isakson (Senator from Georgia)
240,Michael Burgess (Representative from Texas)
241,Joe Courtney (Representative from Connecticut)
242,Jan Schakowsky (Representative from Illinois)
243,Richard Durbin (Senator from Illinois)
244,Scott Garrett (Representative from New Jersey)
245,John Carter (Representative from Texas)
246,Rand Paul (Senator from Kentucky)
247,Linda Sanchez (Representative from California)
248,Ami Bera (Representative from California)
249,Louise Slaughter (Representative from New York)
250,Richard Neal (Representative from Massachusetts)
251,Rosa DeLauro (Representative from Connecticut)
252,Mike Rogers (Representative from Michigan)
253,Roger Wicker (Senator from Mississippi)
254,Peter Visclosky (Representative from Indiana)
255,Steve Pearce (Representative from New Mexico)
256,Susan Collins (Senator from Maine)
257,Claire McCaskill (Senator from Missouri)
258,Steven Chabot (Representative from Ohio)
259,Loretta Sanchez (Representative from California)
260,George Miller (Representative from California)
261,Rick Larsen (Representative from Washington)
262,Steve Southerland (Representative from Florida)
263,Hakeem Jeffries (Representative from New York)
264,Daniel Webster (Representative from Florida)
265,Elijah Cummings (Representative from Maryland)
266,Adam Smith (Representative from Washington)
267,Daniel Coats (Senator from Indiana)
268,John Thune (Senator from South Dakota)
269,Richard Hanna (Representative from New York)
270,Anna Eshoo (Representative from California)
271,Steve Stockman (Representative from Texas)
272,Christopher Coons (Senator from Delaware)
273,John Campbell (Representative from California)
274,Susan Brooks (Representative from Indiana)
275,Marcia Fudge (Representative from Ohio)
276,James Moran (Representative from Virginia)
277,Lucille Roybal-Allard (Representative from California)
278,Jeb Hensarling (Representative from Texas)
279,Kay Granger (Representative from Texas)
280,Carol Shea-Porter (Representative from New Hampshire)
281,Bruce Braley (Representative from Iowa)
282,Charles Rangel (Representative from New York)
283,Doug Collins (Representative from Georgia)
284,Howard Coble (Representative from North Carolina)
285,Fred Upton (Representative from Michigan)
286,Barbara Lee (Representative from California)
287,Marsha Blackburn (Representative from Tennessee)
288,Michael Bennet (Senator from Colorado)
289,Dennis Ross (Representative from Florida)
290,RaÌ¼l Grijalva (Representative from Arizona)
291,Tom Rice (Representative from South Carolina)
292,Lynn Westmoreland (Representative from Georgia)
293,Diane Black (Representative from Tennessee)
294,Dianne Feinstein (Senator from California)
295,Jason Chaffetz (Representative from Utah)
296,Marc Veasey (Representative from Texas)
297,Joseph Kennedy III (Representative from Massachusetts)
298,Kenny Marchant (Representative from Texas)
299,Gus Bilirakis (Representative from Florida)
300,Sanford Bishop Jr. (Representative from Georgia)
301,Carl Levin (Senator from Michigan)
302,Trey Gowdy (Representative from South Carolina)
303,Walter Jones (Representative from North Carolina)
304,Cathy McMorris Rodgers (Representative from Washington)
305,Terri Sewell (Representative from Alabama)
306,John Barrow (Representative from Georgia)
307,John Carney (Representative from Delaware)
308,Thad Cochran (Senator from Mississippi)
309,Frank Wolf (Representative from Virginia)
310,John Kline (Representative from Minnesota)
311,Jackie Walorski (Representative from Indiana)
312,Patty Murray (Senator from Washington)
313,John Duncan Jr. (Representative from Tennessee)
314,Steve Scalise (Representative from Louisiana)
315,Mike Grimm (Representative from New York)
316,Tim Johnson (Senator from South Dakota)
317,James Lankford (Representative from Oklahoma)
318,Dave Loebsack (Representative from Iowa)
319,Jim Cooper (Representative from Tennessee)
320,Dan Kildee (Representative from Michigan)
321,Robert Hurt (Representative from Virginia)
322,Gary Peters (Representative from Michigan)
323,Louie Gohmert (Representative from Texas)
324,Gwen Moore (Representative from Wisconsin)
325,Joe Garcia (Representative from Florida)
326,Nancy Pelosi (Representative from California)
327,Tom Latham (Representative from Iowa)
328,Steven Palazzo (Representative from Mississippi)
329,Cheri Bustos (Representative from Illinois)
330,Markwayne Mullin (Representative from Oklahoma)
331,David Cicilline (Representative from Rhode Island)
332,Justin Amash (Representative from Michigan)
333,Frank Lautenberg (Senator from New Jersey)
334,David Valadao (Representative from California)
335,Mike Johanns (Senator from Nebraska)
336,Tammy Duckworth (Representative from Illinois)
337,Joaquin Castro (Representative from Texas)
338,Tom Reed (Representative from New York)
339,Matt Cartwright (Representative from Pennsylvania)
340,Rodney Frelinghuysen (Representative from New Jersey)
341,Rick Nolan (Representative from Minnesota)
342,Tom Udall (Senator from New Mexico)
343,Jim Matheson (Representative from Utah)
344,Kay Hagan (Senator from North Carolina)
345,Jeff Flake (Senator from Arizona)
346,Brett Guthrie (Representative from Kentucky)
347,John Conyers Jr. (Representative from Michigan)
348,Lamar Smith (Representative from Texas)
349,Suzanne Bonamici (Representative from Oregon)
350,Tulsi Gabbard (Representative from Hawaii)
351,Grace Meng (Representative from New York)
352,Brian Schatz (Senator from Hawaii)
353,Mike Thompson (Representative from California)
354,Diana DeGette (Representative from Colorado)
355,Andy Barr (Representative from Kentucky)
356,Jon Runyan (Representative from New Jersey)
357,Sean Duffy (Representative from Wisconsin)
358,Grace Napolitano (Representative from California)
359,Tom Marino (Representative from Pennsylvania)
360,Ed Perlmutter (Representative from Colorado)
361,Dave Reichert (Representative from Washington)
362,Mark Begich (Senator from Alaska)
363,Deb Fischer (Senator from Nebraska)
364,Lois Capps (Representative from California)
365,James Clyburn (Representative from South Carolina)
366,Ted Deutch (Representative from Florida)
367,Jim Jordan (Representative from Ohio)
368,Jeff Sessions (Senator from Alabama)
369,Ron Johnson (Senator from Wisconsin)
370,Peter Welch (Representative from Vermont)
371,Tom Coburn (Senator from Oklahoma)
372,Robin Kelly (Representative from Illinois)
373,Reid Ribble (Representative from Wisconsin)
374,Lamar Alexander (Senator from Tennessee)
375,Jerrold Nadler (Representative from New York)
376,Marlin Stutzman (Representative from Indiana)
377,Patrick Toomey (Senator from Pennsylvania)
378,Randy Weber (Representative from Texas)
379,Gerald Connolly (Representative from Virginia)
380,Bill Shuster (Representative from Pennsylvania)
381,JosÌ© Serrano (Representative from New York)
382,Jim Costa (Representative from California)
383,Steven Horsford (Representative from Nevada)
384,Richard Shelby (Senator from Alabama)
385,Carolyn Maloney (Representative from New York)
386,Mark Amodei (Representative from Nevada)
387,Jeff Fortenberry (Representative from Nebraska)
388,Steve Israel (Representative from New York)
389,Don Young (Representative from Alaska)
390,Mark Takano (Representative from California)
391,Ted Yoho (Representative from Florida)
392,Lloyd Doggett (Representative from Texas)
393,Adrian Smith (Representative from Nebraska)
394,John Tierney (Representative from Massachusetts)
395,Tom Cole (Representative from Oklahoma)
396,Stephen Lynch (Representative from Massachusetts)
397,Jeff Miller (Representative from Florida)
398,Mark Warner (Senator from Virginia)
399,Susan Davis (Representative from California)
400,Ed Royce (Representative from California)
401,Pete Olson (Representative from Texas)
402,Lisa Murkowski (Senator from Alaska)
403,Denny Heck (Representative from Washington)
404,Ben Lujan (Representative from New Mexico)
405,Xavier Becerra (Representative from California)
406,Robert Latta (Representative from Ohio)
407,William Thornberry (Representative from Texas)
408,Morgan Griffith (Representative from Virginia)
409,Bennie Thompson (Representative from Mississippi)
410,Spencer Bachus (Representative from Alabama)
411,Randy Neugebauer (Representative from Texas)
412,Mick Mulvaney (Representative from South Carolina)
413,Doc Hastings (Representative from Washington)
414,John Boozman (Senator from Arkansas)
415,Mo Brooks (Representative from Alabama)
416,Hank Johnson (Representative from Georgia)
417,Mike Kelly (Representative from Pennsylvania)
418,Gregory Meeks (Representative from New York)
419,Jo Ann Emerson (Representative from Missouri)
420,John Lewis (Representative from Georgia)
421,Ander Crenshaw (Representative from Florida)
422,Paul Ryan (Representative from Wisconsin)
423,George Holding (Representative from North Carolina)
424,Tim Kaine (Senator from Virginia)
425,Mike Rogers (Representative from Alabama)
426,Scott Rigell (Representative from Virginia)
427,John Larson (Representative from Connecticut)
428,Trent Franks (Representative from Arizona)
429,Julia Brownley (Representative from California)
430,Andy Harris (Representative from Maryland)
431,Harry Reid (Senator from Nevada)
432,John Yarmuth (Representative from Kentucky)
433,Ralph Hall (Representative from Texas)
434,Judy Chu (Representative from California)
435,J. Forbes (Representative from Virginia)
436,Bill Nelson (Senator from Florida)
437,Corrine Brown (Representative from Florida)
438,David Scott (Representative from Georgia)
439,Marcy Kaptur (Representative from Ohio)
440,Jared Huffman (Representative from California)
441,Paul Cook (Representative from California)
442,Luke Messer (Representative from Indiana)
443,Karen Bass (Representative from California)
444,Jared Polis (Representative from Colorado)
445,Chellie Pingree (Representative from Maine)
446,Gene Green (Representative from Texas)
447,Sam Johnson (Representative from Texas)
448,F. Sensenbrenner (Representative from Wisconsin)
449,Mike McIntyre (Representative from North Carolina)
450,Rush Holt (Representative from New Jersey)
451,Henry Waxman (Representative from California)
452,Bobby Rush (Representative from Illinois)
453,Colleen Hanabusa (Representative from Hawaii)
454,Peter King (Representative from New York)
455,Austin Scott (Representative from Georgia)
456,Michael Michaud (Representative from Maine)
457,William Cowan (Senator from Massachusetts)
458,Alan Nunnelee (Representative from Mississippi)
459,Martin Heinrich (Senator from New Mexico)
460,Madeleine Bordallo (Representative from NA)
461,G. Butterfield (Representative from North Carolina)
462,Lou Barletta (Representative from Pennsylvania)
463,Bradley Byrne (Representative from Alabama)
464,Michael Capuano (Representative from Massachusetts)
465,Joseph Crowley (Representative from New York)
466,Katherine Clark (Representative from Massachusetts)
467,Danny Davis (Representative from Illinois)
468,Peter DeFazio (Representative from Oregon)
469,Mike Doyle (Representative from Pennsylvania)
470,Charlie Dent (Representative from Pennsylvania)
471,Suzan DelBene (Representative from Washington)
472,Luis Gutierrez (Representative from Illinois)
473,Sam Graves (Representative from Missouri)
474,Al Green (Representative from Texas)
475,Bob Gibbs (Representative from Ohio)
476,Alcee Hastings (Representative from Florida)
477,RubÌ©n Hinojosa (Representative from Texas)
478,Duncan Hunter (Representative from California)
479,Jaime Herrera Beutler (Representative from Washington)
480,James Inhofe (Senator from Oklahoma)
481,Steve King (Representative from Iowa)
482,Ann Kirkpatrick (Representative from Arizona)
483,Bill Keating (Representative from Massachusetts)
484,Derek Kilmer (Representative from Washington)
485,Leonard Lance (Representative from New Jersey)
486,Cynthia Lummis (Representative from Wyoming)
487,Jim McDermott (Representative from Washington)
488,John Mica (Representative from Florida)
489,Doris Matsui (Representative from California)
490,Beto O&#x27;Rourke (Representative from Texas)
491,Pedro Pierluisi (Representative from NA)
492,Mark Sanford (Representative from South Carolina)
493,Charles Schumer (Senator from New York)
494,Mike Simpson (Representative from Idaho)
495,Albio Sires (Representative from New Jersey)
496,Gregorio &#x27;Kilili&#x27; Sablan (Representative from NA)
497,Chris Stewart (Representative from Utah)
498,Pat Tiberi (Representative from Ohio)
499,Jon Tester (Senator from Montana)
500,Nydia VelÌÁzquez (Representative from New York)
501,Filemon Vela (Representative from Texas)
502,Joe Wilson (Representative from South Carolina)
503,Rob Woodall (Representative from Georgia)
504,Elizabeth Warren (Senator from Massachusetts)
